{
  "schemaVersion": "1.0.0",
  "queryId": "F1-01",
  "userInput": "我的扫地机充不进电了",
  "reference": "可以先按这个顺序排查：1) 把主机放回充电座或基站，看指示灯是否亮起。",
  "referenceDocIds": ["FAQ_VAC_001", "CODE_VAC_001", "MANUAL_VAC_001"],
  "referenceDocIdsNice": [],
  "intentL1": "FEEDBACK",
  "intentL2": "F1_故障报告",
  "difficulty": "easy",
  "requiresRag": true,
  "response": "建议先确认充电座供电与触点清洁，再观察指示灯状态。",
  "thinking": null,
  "latencyMs": 3200,
  "firstTokenMs": 480,
  "finalStatus": "success",
  "error": null,
  "conversationId": "conv_example_001",
  "taskId": "task_example_001",
  "traceId": "trace_example_001",
  "retrievedDocIds": ["FAQ_VAC_001", "MANUAL_VAC_001"],
  "retrievedDocIdsRaw": ["FAQ_VAC_001", "MANUAL_VAC_001"],
  "retrievedChunkIds": ["chunk_1", "chunk_2"],
  "retrievedContexts": ["充电故障排查步骤……", "触点清洁说明……"],
  "retrievedContextDocIds": ["FAQ_VAC_001", "MANUAL_VAC_001"],
  "intentPred": "F1_故障报告",
  "intentPredAll": ["F1_故障报告"],
  "hasKb": true,
  "hasMcp": false,
  "retrievalSkipped": false,
  "skipReason": null,
  "evalLatencyMs": 210,
  "evidenceSource": "DUAL_PATH_CHAT_AND_EVAL",
  "chatStartedAt": "2026-07-30T02:00:00.000Z",
  "chatFinishedAt": "2026-07-30T02:00:03.200Z",
  "evalStartedAt": "2026-07-30T02:00:03.300Z",
  "evalFinishedAt": "2026-07-30T02:00:03.510Z"
}
